{
  "schemaVersion": "1.1.0",
  "deploymentReady": true,
  "releaseId": "example-1.0.0-polygon",
  "createdAt": "2026-09-27T00:00:00Z",
  "scope": {
    "scopeId": "example-contract-v1",
    "sourceCommit": "0123456789abcdef0123456789abcdef01234567",
    "includedContracts": ["sources/Example.sol:Example"],
    "excludedPaths": ["script/", "broadcast/"]
  },
  "contract": {
    "name": "Example",
    "sourcePath": "sources/Example.sol",
    "sourceSha256": "1111111111111111111111111111111111111111111111111111111111111111"
  },
  "sources": [
    {
      "path": "sources/Example.sol",
      "sha256": "1111111111111111111111111111111111111111111111111111111111111111"
    }
  ],
  "build": {
    "compilerVersion": "0.8.24+commit.e11b9ed9",
    "evmVersion": "shanghai",
    "optimizer": { "enabled": true, "runs": 200 },
    "viaIR": false,
    "compilerInputSha256": "bbbbbbbbbbbbbbbbbbbbbbbbbbbbbbbbbbbbbbbbbbbbbbbbbbbbbbbbbbbbbbbb",
    "artifactSha256": "aaaaaaaaaaaaaaaaaaaaaaaaaaaaaaaaaaaaaaaaaaaaaaaaaaaaaaaaaaaaaaaa",
    "creationBytecodeSha256": "cccccccccccccccccccccccccccccccccccccccccccccccccccccccccccccccc",
    "deployedBytecodeSha256": "dddddddddddddddddddddddddddddddddddddddddddddddddddddddddddddddd",
    "linkReferences": {},
    "immutableReferences": {}
  },
  "target": { "chainId": 137, "evmVersion": "shanghai", "nativeCurrency": "POL" },
  "constructor": {
    "signature": "constructor(uint256)",
    "parameters": [
      { "name": "initialFee", "solidityType": "uint256", "value": "10000000000000000" }
    ],
    "encodedArgsSha256": "eeeeeeeeeeeeeeeeeeeeeeeeeeeeeeeeeeeeeeeeeeeeeeeeeeeeeeeeeeeeeeee",
    "initCodeSha256": "ffffffffffffffffffffffffffffffffffffffffffffffffffffffffffffffff"
  },
  "ownership": {
    "initialOwner": "0x0000000000000000000000000000000000000001",
    "postDeploymentProcedure": "Transfer through the contract's documented two-step ownership flow."
  },
  "files": {
    "SPEC.md": "2222222222222222222222222222222222222222222222222222222222222222",
    "abi.json": "3333333333333333333333333333333333333333333333333333333333333333",
    "audit-report.md": "4444444444444444444444444444444444444444444444444444444444444444",
    "build-artifact.json": "aaaaaaaaaaaaaaaaaaaaaaaaaaaaaaaaaaaaaaaaaaaaaaaaaaaaaaaaaaaaaaaa",
    "compiler-input.json": "bbbbbbbbbbbbbbbbbbbbbbbbbbbbbbbbbbbbbbbbbbbbbbbbbbbbbbbbbbbbbbbb",
    "constructor-args.hex": "eeeeeeeeeeeeeeeeeeeeeeeeeeeeeeeeeeeeeeeeeeeeeeeeeeeeeeeeeeeeeeee",
    "constructor-schema.json": "5555555555555555555555555555555555555555555555555555555555555555",
    "creation-bytecode.hex": "cccccccccccccccccccccccccccccccccccccccccccccccccccccccccccccccc",
    "deployed-bytecode.hex": "dddddddddddddddddddddddddddddddddddddddddddddddddddddddddddddddd",
    "deployment-manifest.schema.json": "6666666666666666666666666666666666666666666666666666666666666666",
    "deployment-values.json": "7777777777777777777777777777777777777777777777777777777777777777",
    "init-code.hex": "ffffffffffffffffffffffffffffffffffffffffffffffffffffffffffffffff",
    "remediation-history.md": "8888888888888888888888888888888888888888888888888888888888888888",
    "sources/Example.sol": "1111111111111111111111111111111111111111111111111111111111111111",
    "traceability.json": "9999999999999999999999999999999999999999999999999999999999999999"
  },
  "dependencies": [],
  "commands": {
    "build": ["forge clean", "forge build --force --build-info"],
    "test": ["forge test -vvv"],
    "analyze": ["slither . --config-file slither.config.json"]
  },
  "findings": [],
  "cleanRoomRebuild": {
    "command": "forge clean && forge build --force --build-info && forge test -vvv",
    "comparedArtifacts": ["abi.json", "creation-bytecode.hex", "deployed-bytecode.hex"],
    "result": "Pass"
  },
  "missingArtifacts": [],
  "limitations": []
}
